{
  "aif_version": "1.0.0",
  "task_id": "task-2026-001",
  "task_summary": "Implement and verify snapshot-bound claim validation in src/verifier.py and tests/test_verifier.py.",
  "authority_context": {
    "repository": "Abdus2023/ATSAS",
    "working_branch": "arena/01a0ecca-atsas",
    "governance_policy_ref": "examples/governance-policy.json",
    "invoked_skills": [
      "skill-tdd-implementation"
    ],
    "invoked_tools": [
      "read_file",
      "edit_file",
      "bash"
    ]
  },
  "initial_snapshot_id": "snap-001",
  "final_snapshot_id": "snap-002",
  "snapshots": [
    {
      "snapshot_id": "snap-001",
      "parent_snapshot_id": null,
      "git_head_sha": "15f7fa01778f06821d1c5c9c285bb0d666e04f8b",
      "tree_hash": "a1b2c3d4e5f60718293a4b5c6d7e8f90a1b2c3d4",
      "timestamp": "2026-09-29T10:55:00Z",
      "caused_by_execution_id": null,
      "modified_paths": []
    },
    {
      "snapshot_id": "snap-002",
      "parent_snapshot_id": "snap-001",
      "git_head_sha": "15f7fa01778f06821d1c5c9c285bb0d666e04f8b",
      "tree_hash": "f9e8d7c6b5a4938271605f4e3d2c1b0a9f8e7d6c",
      "timestamp": "2026-09-29T10:56:30Z",
      "caused_by_execution_id": "exec-001",
      "modified_paths": [
        "src/verifier.py",
        "tests/test_verifier.py"
      ]
    }
  ],
  "executions": [
    {
      "execution_id": "exec-001",
      "admission": {
        "status": "ADMITTED",
        "authority_scope": "WRITE_WORKSPACE",
        "policy_ref": "examples/governance-policy.json"
      },
      "tool_id": "edit_file",
      "invocation_summary": "Update src/verifier.py and tests/test_verifier.py with snapshot freshness checks",
      "pre_snapshot_id": "snap-001",
      "post_snapshot_id": "snap-002",
      "observation": {
        "observation_id": "obs-001",
        "snapshot_id": "snap-002",
        "observability_status": "FULL",
        "exit_code": 0,
        "output_digest": "sha256:1111111111111111111111111111111111111111111111111111111111111111",
        "summary": "Files written and diff attributed to snap-002."
      }
    },
    {
      "execution_id": "exec-002",
      "admission": {
        "status": "ADMITTED",
        "authority_scope": "EXECUTE_SANDBOX_COMMAND",
        "policy_ref": "examples/governance-policy.json"
      },
      "tool_id": "bash",
      "invocation_summary": "pytest tests/test_verifier.py",
      "pre_snapshot_id": "snap-002",
      "post_snapshot_id": "snap-002",
      "observation": {
        "observation_id": "obs-002",
        "snapshot_id": "snap-002",
        "observability_status": "FULL",
        "exit_code": 0,
        "output_digest": "sha256:2222222222222222222222222222222222222222222222222222222222222222",
        "summary": "12 passed in 0.18s against snap-002."
      }
    }
  ],
  "evidence": [
    {
      "evidence_id": "evid-001",
      "artifact_kind": "TEST_SUITE_RESULT",
      "snapshot_id": "snap-002",
      "tree_hash": "f9e8d7c6b5a4938271605f4e3d2c1b0a9f8e7d6c",
      "scope": [
        "src/verifier.py",
        "tests/test_verifier.py"
      ],
      "execution_id": "exec-002",
      "observation_id": "obs-002",
      "predicate_satisfied": true,
      "digest": "sha256:3333333333333333333333333333333333333333333333333333333333333333"
    }
  ],
  "claims": [
    {
      "claim_id": "claim-001",
      "statement": "Snapshot freshness validation in src/verifier.py passes all unit tests in tests/test_verifier.py at snap-002.",
      "scope": [
        "src/verifier.py",
        "tests/test_verifier.py"
      ],
      "snapshot_id": "snap-002",
      "status": "VERIFIED",
      "evidence_ids": [
        "evid-001"
      ],
      "verification_notes": "Bound to final snapshot snap-002 with full observability and zero failing assertions."
    }
  ],
  "acceptance_criteria": [
    {
      "criterion_id": "ac-001",
      "description": "Verifier implementation and unit test suite pass at the final repository snapshot.",
      "mandatory": true,
      "required_scope": [
        "src/verifier.py",
        "tests/test_verifier.py"
      ],
      "required_claim_ids": [
        "claim-001"
      ],
      "status": "ACCEPTED"
    }
  ],
  "completion": {
    "status": "COMPLETE",
    "final_snapshot_id": "snap-002",
    "blocking_states": [],
    "summary": "All mandatory acceptance criteria are ACCEPTED and backed by fresh, snapshot-bound, scope-bounded VERIFIED evidence at snap-002."
  }
}
